    1   0.000000    10.0.2.15 → 24.143.206.48 TCP 74 40942 → 80 [SYN] Seq=0 Win=29200 Len=0 MSS=1460 SACK_PERM=1 TSval=1772647890 TSecr=0 WS=128
    2   0.020446 24.143.206.48 → 10.0.2.15    TCP 60 80 → 40942 [SYN, ACK] Seq=0 Ack=1 Win=65535 Len=0 MSS=1460
    3   0.020482    10.0.2.15 → 24.143.206.48 TCP 54 40942 → 80 [ACK] Seq=1 Ack=1 Win=29200 Len=0
    4   0.020822    10.0.2.15 → 24.143.206.48 HTTP 342 GET /success.txt HTTP/1.1 
    5   0.021105 24.143.206.48 → 10.0.2.15    TCP 60 80 → 40942 [ACK] Seq=1 Ack=289 Win=65535 Len=0
    6   0.047318 24.143.206.48 → 10.0.2.15    HTTP 438 HTTP/1.1 200 OK  (text/plain)
    7   0.047343    10.0.2.15 → 24.143.206.48 TCP 54 40942 → 80 [ACK] Seq=289 Ack=385 Win=30016 Len=0
    8   1.111401    10.0.2.15 → 24.143.206.48 HTTP 342 GET /success.txt HTTP/1.1 
    9   1.111632 24.143.206.48 → 10.0.2.15    TCP 60 80 → 40942 [ACK] Seq=385 Ack=577 Win=65535 Len=0
   10   1.130723 24.143.206.48 → 10.0.2.15    HTTP 438 HTTP/1.1 200 OK  (text/plain)
   11   1.130745    10.0.2.15 → 24.143.206.48 TCP 54 40942 → 80 [ACK] Seq=577 Ack=769 Win=31088 Len=0
   12   7.400363    10.0.2.15 → 52.89.196.244 TCP 74 33456 → 443 [SYN] Seq=0 Win=29200 Len=0 MSS=1460 SACK_PERM=1 TSval=843719217 TSecr=0 WS=128
   13   7.509322 52.89.196.244 → 10.0.2.15    TCP 60 443 → 33456 [SYN, ACK] Seq=0 Ack=1 Win=65535 Len=0 MSS=1460
   14   7.509360    10.0.2.15 → 52.89.196.244 TCP 54 33456 → 443 [ACK] Seq=1 Ack=1 Win=29200 Len=0
   15   7.509859    10.0.2.15 → 52.89.196.244 TLSv1 260 Client Hello
   16   7.510160 52.89.196.244 → 10.0.2.15    TCP 60 443 → 33456 [ACK] Seq=1 Ack=207 Win=65535 Len=0
   17   7.621188 52.89.196.244 → 10.0.2.15    TLSv1.2 2894 Server Hello
   18   7.621211    10.0.2.15 → 52.89.196.244 TCP 54 33456 → 443 [ACK] Seq=207 Ack=2841 Win=34080 Len=0
   19   7.621594 52.89.196.244 → 10.0.2.15    TLSv1.2 931 Certificate, Server Key Exchange, Server Hello Done
   20   7.621609    10.0.2.15 → 52.89.196.244 TCP 54 33456 → 443 [ACK] Seq=207 Ack=3718 Win=36920 Len=0
   21   7.626549    10.0.2.15 → 52.89.196.244 TLSv1.2 180 Client Key Exchange, Change Cipher Spec, Encrypted Handshake Message
   22   7.626992 52.89.196.244 → 10.0.2.15    TCP 60 443 → 33456 [ACK] Seq=3718 Ack=333 Win=65535 Len=0
   23   7.628977    10.0.2.15 → 72.21.91.29  TCP 74 56930 → 80 [SYN] Seq=0 Win=29200 Len=0 MSS=1460 SACK_PERM=1 TSval=2337804877 TSecr=0 WS=128
   24   7.656695  72.21.91.29 → 10.0.2.15    TCP 60 80 → 56930 [SYN, ACK] Seq=0 Ack=1 Win=65535 Len=0 MSS=1460
   25   7.656731    10.0.2.15 → 72.21.91.29  TCP 54 56930 → 80 [ACK] Seq=1 Ack=1 Win=29200 Len=0
   26   7.657047    10.0.2.15 → 72.21.91.29  OCSP 485 Request
   27   7.657245  72.21.91.29 → 10.0.2.15    TCP 60 80 → 56930 [ACK] Seq=1 Ack=432 Win=65535 Len=0
   28   7.686593  72.21.91.29 → 10.0.2.15    OCSP 842 Response
   29   7.686611    10.0.2.15 → 72.21.91.29  TCP 54 56930 → 80 [ACK] Seq=432 Ack=789 Win=30732 Len=0
   30   7.688430    10.0.2.15 → 72.21.91.29  OCSP 485 Request
   31   7.688796  72.21.91.29 → 10.0.2.15    TCP 60 80 → 56930 [ACK] Seq=789 Ack=863 Win=65535 Len=0
   32   7.713148  72.21.91.29 → 10.0.2.15    OCSP 842 Response
   33   7.714425    10.0.2.15 → 52.89.196.244 TLSv1.2 496 Application Data
   34   7.714768 52.89.196.244 → 10.0.2.15    TCP 60 443 → 33456 [ACK] Seq=3718 Ack=775 Win=65535 Len=0
   35   7.734626 52.89.196.244 → 10.0.2.15    TLSv1.2 105 Change Cipher Spec, Encrypted Handshake Message
   36   7.756075    10.0.2.15 → 72.21.91.29  TCP 54 56930 → 80 [ACK] Seq=863 Ack=1577 Win=32308 Len=0
   37   7.776107    10.0.2.15 → 52.89.196.244 TCP 54 33456 → 443 [ACK] Seq=775 Ack=3769 Win=36920 Len=0
   38   7.841436 52.89.196.244 → 10.0.2.15    TLSv1.2 1189 Application Data
   39   7.841455    10.0.2.15 → 52.89.196.244 TCP 54 33456 → 443 [ACK] Seq=775 Ack=4904 Win=39760 Len=0
   40  11.140094    10.0.2.15 → 24.143.206.48 TCP 54 [TCP Keep-Alive] 40942 → 80 [ACK] Seq=576 Ack=769 Win=31088 Len=0
   41  11.140701 24.143.206.48 → 10.0.2.15    TCP 60 [TCP Keep-Alive ACK] 80 → 40942 [ACK] Seq=769 Ack=577 Win=65535 Len=0
   42  11.472956    10.0.2.15 → 72.21.91.29  TCP 54 56930 → 80 [FIN, ACK] Seq=863 Ack=1577 Win=32308 Len=0
   43  11.473148    10.0.2.15 → 52.89.196.244 TLSv1.2 85 Encrypted Alert
   44  11.473350    10.0.2.15 → 52.89.196.244 TCP 54 33456 → 443 [FIN, ACK] Seq=806 Ack=4904 Win=39760 Len=0
   45  11.473480  72.21.91.29 → 10.0.2.15    TCP 60 80 → 56930 [ACK] Seq=1577 Ack=864 Win=65535 Len=0
   46  11.473505 52.89.196.244 → 10.0.2.15    TCP 60 443 → 33456 [ACK] Seq=4904 Ack=806 Win=65535 Len=0
   47  11.473508 52.89.196.244 → 10.0.2.15    TCP 60 443 → 33456 [ACK] Seq=4904 Ack=807 Win=65535 Len=0
   48  11.474356    10.0.2.15 → 24.143.206.48 TCP 54 40942 → 80 [FIN, ACK] Seq=577 Ack=769 Win=31088 Len=0
   49  11.474652 24.143.206.48 → 10.0.2.15    TCP 60 80 → 40942 [ACK] Seq=769 Ack=578 Win=65535 Len=0
   50  11.498802  72.21.91.29 → 10.0.2.15    TCP 60 80 → 56930 [FIN, ACK] Seq=1577 Ack=864 Win=65535 Len=0
   51  11.498832    10.0.2.15 → 72.21.91.29  TCP 54 56930 → 80 [ACK] Seq=864 Ack=1578 Win=32308 Len=0
   52  11.499480 24.143.206.48 → 10.0.2.15    TCP 60 80 → 40942 [FIN, ACK] Seq=769 Ack=578 Win=65535 Len=0
   53  11.499507    10.0.2.15 → 24.143.206.48 TCP 54 40942 → 80 [ACK] Seq=578 Ack=770 Win=31088 Len=0
   54  11.588690 52.89.196.244 → 10.0.2.15    TLSv1.2 85 Encrypted Alert
   55  11.588722    10.0.2.15 → 52.89.196.244 TCP 54 33456 → 443 [RST] Seq=807 Win=0 Len=0
   56  11.588781 52.89.196.244 → 10.0.2.15    TCP 60 443 → 33456 [FIN, ACK] Seq=4935 Ack=807 Win=65535 Len=0
   57  11.588789    10.0.2.15 → 52.89.196.244 TCP 54 33456 → 443 [RST] Seq=807 Win=0 Len=0
   58  11.589090 52.89.196.244 → 10.0.2.15    TCP 60 443 → 33456 [RST, ACK] Seq=4245239295 Ack=807 Win=0 Len=0
