    1   0.000000    10.0.2.15 → 24.143.206.48 TCP 74 40948 → 80 [SYN] Seq=0 Win=29200 Len=0 MSS=1460 SACK_PERM=1 TSval=1772680448 TSecr=0 WS=128
    2   0.032525 24.143.206.48 → 10.0.2.15    TCP 60 80 → 40948 [SYN, ACK] Seq=0 Ack=1 Win=65535 Len=0 MSS=1460
    3   0.032627    10.0.2.15 → 24.143.206.48 TCP 54 40948 → 80 [ACK] Seq=1 Ack=1 Win=29200 Len=0
    4   0.032953    10.0.2.15 → 24.143.206.48 HTTP 342 GET /success.txt HTTP/1.1 
    5   0.033255 24.143.206.48 → 10.0.2.15    TCP 60 80 → 40948 [ACK] Seq=1 Ack=289 Win=65535 Len=0
    6   0.077271 24.143.206.48 → 10.0.2.15    HTTP 438 HTTP/1.1 200 OK  (text/plain)
    7   0.077302    10.0.2.15 → 24.143.206.48 TCP 54 40948 → 80 [ACK] Seq=289 Ack=385 Win=30016 Len=0
    8   1.305578    10.0.2.15 → 24.143.206.48 HTTP 342 GET /success.txt HTTP/1.1 
    9   1.306712 24.143.206.48 → 10.0.2.15    TCP 60 80 → 40948 [ACK] Seq=385 Ack=577 Win=65535 Len=0
   10   1.327090 24.143.206.48 → 10.0.2.15    HTTP 438 HTTP/1.1 200 OK  (text/plain)
   11   1.327145    10.0.2.15 → 24.143.206.48 TCP 54 40948 → 80 [ACK] Seq=577 Ack=769 Win=31088 Len=0
   12   7.612008    10.0.2.15 → 52.89.235.25 TCP 74 57946 → 443 [SYN] Seq=0 Win=29200 Len=0 MSS=1460 SACK_PERM=1 TSval=628674843 TSecr=0 WS=128
   13   7.718433 52.89.235.25 → 10.0.2.15    TCP 60 443 → 57946 [SYN, ACK] Seq=0 Ack=1 Win=65535 Len=0 MSS=1460
   14   7.718476    10.0.2.15 → 52.89.235.25 TCP 54 57946 → 443 [ACK] Seq=1 Ack=1 Win=29200 Len=0
   15   7.718970    10.0.2.15 → 52.89.235.25 TLSv1 260 Client Hello
   16   7.719340 52.89.235.25 → 10.0.2.15    TCP 60 443 → 57946 [ACK] Seq=1 Ack=207 Win=65535 Len=0
   17   7.833834 52.89.235.25 → 10.0.2.15    TLSv1.2 1502 Server Hello
   18   7.833861    10.0.2.15 → 52.89.235.25 TCP 54 57946 → 443 [ACK] Seq=207 Ack=1449 Win=31240 Len=0
   19   7.834893 52.89.235.25 → 10.0.2.15    TLSv1.2 2323 Certificate, Server Key Exchange, Server Hello Done
   20   7.834917    10.0.2.15 → 52.89.235.25 TCP 54 57946 → 443 [ACK] Seq=207 Ack=3718 Win=35500 Len=0
   21   7.843971    10.0.2.15 → 52.89.235.25 TLSv1.2 180 Client Key Exchange, Change Cipher Spec, Encrypted Handshake Message
   22   7.844319 52.89.235.25 → 10.0.2.15    TCP 60 443 → 57946 [ACK] Seq=3718 Ack=333 Win=65535 Len=0
   23   7.844393    10.0.2.15 → 72.21.91.29  TCP 74 56936 → 80 [SYN] Seq=0 Win=29200 Len=0 MSS=1460 SACK_PERM=1 TSval=2337837651 TSecr=0 WS=128
   24   7.909493  72.21.91.29 → 10.0.2.15    TCP 60 80 → 56936 [SYN, ACK] Seq=0 Ack=1 Win=65535 Len=0 MSS=1460
   25   7.909536    10.0.2.15 → 72.21.91.29  TCP 54 56936 → 80 [ACK] Seq=1 Ack=1 Win=29200 Len=0
   26   7.909783    10.0.2.15 → 72.21.91.29  OCSP 485 Request
   27   7.910076  72.21.91.29 → 10.0.2.15    TCP 60 80 → 56936 [ACK] Seq=1 Ack=432 Win=65535 Len=0
   28   7.946729  72.21.91.29 → 10.0.2.15    OCSP 842 Response
   29   7.946761    10.0.2.15 → 72.21.91.29  TCP 54 56936 → 80 [ACK] Seq=432 Ack=789 Win=30732 Len=0
   30   7.947646 52.89.235.25 → 10.0.2.15    TLSv1.2 105 Change Cipher Spec, Encrypted Handshake Message
   31   7.949008    10.0.2.15 → 72.21.91.29  OCSP 485 Request
   32   7.949441  72.21.91.29 → 10.0.2.15    TCP 60 80 → 56936 [ACK] Seq=789 Ack=863 Win=65535 Len=0
   33   7.975246  72.21.91.29 → 10.0.2.15    OCSP 842 Response
   34   7.976577    10.0.2.15 → 52.89.235.25 TLSv1.2 496 Application Data
   35   7.976922 52.89.235.25 → 10.0.2.15    TCP 60 443 → 57946 [ACK] Seq=3769 Ack=775 Win=65535 Len=0
   36   8.027305    10.0.2.15 → 72.21.91.29  TCP 54 56936 → 80 [ACK] Seq=863 Ack=1577 Win=32308 Len=0
   37   8.084183 52.89.235.25 → 10.0.2.15    TLSv1.2 1189 Application Data
   38   8.131302    10.0.2.15 → 52.89.235.25 TCP 54 57946 → 443 [ACK] Seq=775 Ack=4904 Win=38340 Len=0
   39  10.437119    10.0.2.15 → 72.21.91.29  TCP 54 56936 → 80 [FIN, ACK] Seq=863 Ack=1577 Win=32308 Len=0
   40  10.437381    10.0.2.15 → 52.89.235.25 TLSv1.2 85 Encrypted Alert
   41  10.438042  72.21.91.29 → 10.0.2.15    TCP 60 80 → 56936 [ACK] Seq=1577 Ack=864 Win=65535 Len=0
   42  10.438067 52.89.235.25 → 10.0.2.15    TCP 60 443 → 57946 [ACK] Seq=4904 Ack=806 Win=65535 Len=0
   43  10.438153    10.0.2.15 → 52.89.235.25 TCP 54 57946 → 443 [FIN, ACK] Seq=806 Ack=4904 Win=38340 Len=0
   44  10.438401 52.89.235.25 → 10.0.2.15    TCP 60 443 → 57946 [ACK] Seq=4904 Ack=807 Win=65535 Len=0
   45  10.439147    10.0.2.15 → 24.143.206.48 TCP 54 40948 → 80 [FIN, ACK] Seq=577 Ack=769 Win=31088 Len=0
   46  10.439422 24.143.206.48 → 10.0.2.15    TCP 60 80 → 40948 [ACK] Seq=769 Ack=578 Win=65535 Len=0
   47  10.465493  72.21.91.29 → 10.0.2.15    TCP 60 80 → 56936 [FIN, ACK] Seq=1577 Ack=864 Win=65535 Len=0
   48  10.465557    10.0.2.15 → 72.21.91.29  TCP 54 56936 → 80 [ACK] Seq=864 Ack=1578 Win=32308 Len=0
   49  10.465613 24.143.206.48 → 10.0.2.15    TCP 60 80 → 40948 [FIN, ACK] Seq=769 Ack=578 Win=65535 Len=0
   50  10.465622    10.0.2.15 → 24.143.206.48 TCP 54 40948 → 80 [ACK] Seq=578 Ack=770 Win=31088 Len=0
   51  10.548755 52.89.235.25 → 10.0.2.15    TLSv1.2 85 Encrypted Alert
   52  10.548787    10.0.2.15 → 52.89.235.25 TCP 54 57946 → 443 [RST] Seq=807 Win=0 Len=0
   53  10.548859 52.89.235.25 → 10.0.2.15    TCP 60 443 → 57946 [FIN, ACK] Seq=4935 Ack=807 Win=65535 Len=0
   54  10.548868    10.0.2.15 → 52.89.235.25 TCP 54 57946 → 443 [RST] Seq=807 Win=0 Len=0
   55  10.549203 52.89.235.25 → 10.0.2.15    TCP 60 443 → 57946 [RST, ACK] Seq=4243575295 Ack=807 Win=0 Len=0
